name_of_drug,use_case_for_drug,review_by_patient
Stadol,Labor Pain,"""I was put in the hospital a month before the delivery of my twins, and stadol worked great for contractions. It also helped me sleep a lot better."""
Ambien,Insomnia,"""I&#039;ve had horrible insomnia since I was a child. Diagnosed with severe sleep apnea a few years ago.  Ambien is not the holy grail.  You build up a tolerance over the years but 12.5 is as high as most doctors will go ) from 10, 8 years ago).  Pluses for Ambien - it will put you to sleep; no half-life so no grogginess in the morning.  Minuses- it will put you to sleep but generally not keep you asleep.  Thus the waking up wide awake at 3 a.m.  There is now intermezzo - and sublingual 3.5 dose of Ambien meant for  this problem - works for me 50% of the time- otherwise I just stay up.  Another minus - if you take Ambien on a full stomach IT WILL NOT WORK. I generally eat before 5 and allow 5 hours before I take it.  But in all - a savior!"""
Amitriptyline,Pain,"""I&#039;m 20 years old and have both fibromyalgia and rheumatoid arthritis. I also use amitriptyline to treat my depression and my sleep. Before my rheumatologist prescribed this, I went through numerous other things which all caused me to get horrible headaches, stomach problems, and did nothing for my depression. 

I sleep well pretty much every night and I dont wake up feeling groggy, I dont have as many &#039;bad body days&#039; anymore, and I feel way better emotionally."""
Tri-Sprintec,Birth Control,"""Been on this pill for 6 months now. Never had any problems like everyone else. I always had trouble with my periods; lasted 8 days, super heavy, sick when I started and bad cramps. Plus my period lasts only 4 days. The only side effects I have is light cramps and not as hungry anymore. I weighed 160lbs and now weigh 147lbs. I love this pill and will continue taking it."""
Diphenhydramine,Allergic Reactions,"""I have had allergy all my life, pretty severe and I live in allergy heaven in TX. I have tried Everything and for me, benedryl is still the best.
I work and it does not effect me, I often take it several times a day."""
Ziprasidone,Bipolar Disorde,"""I&#039;ve taken it for only 3 days and a haff. It has positive affect for my bipolar. the 1st day I was so scared and wanted to give up because of drowsiness and tiress, nightmare (40mg mornig and 40mg afternoon). but after I cut the dose down (40mg/ night only)  everything&#039;s gone good. I&#039;ve got feelings of happiness which I&#039;ve lost for long time!!! I think it works for depression combine bibolar. but the problem that it make me difficuty to feel asleep. I coudn&#039;t sleep early, woke up until 2am!!! I&#039;m looking to see my doctor soon."""
St. john's wort,Depression,"""I am taking this along with Buspar for my anxiety and depression. I only had anxiety so I was only taking Buspar, but it seems as though Buspar took away the anxiety and brought on depression. I&#039;m against taking SSRI&#039;s or other antidepressants, so I asked my doctor first about possible interactions, then bought some St. John&#039;s Wort. Ever since, it hasn&#039;t happened to me anymore. I also have no side effects at all from it. Some people say it will give u headaches, but I&#039;ve never had one. I personally believe that if u truly need this, there will be no headaches because your body needs it. But who knows, that&#039;s just my personal opinion :) it doesn&#039;t hurt to try it!"""
BuSpar,Anxiety,"""I&#039;ve been taking 15 mg 2x/day with good results.  My social anxiety has improved and I am sleeping much better.  I have been taking Ambien almost every night for the past 4 years and now down to less than 1x/week.  That to me has made it worth it."""
Camrese,Birth Control,"""I am on the 3rd sheet of pills so about 3 months in... before taking i weighed 120 now I am 130... feel depressed, just this week started to get brown discharge and thick red blood clots, try to take the pill everyday with my coffee but I was an hour off a few times, my boobs grew from C to double DD I don&#039;t mind but I do feel bloated and have had a couple angry depressed days..not sure its worth these symptoms but before I had such bad cramps n migraines was in bed every month for 2 days at least. Plus I thought only being 29 having early menopause with hot flashes n migraines this would help me... not sure yet. Staying on for another week or soo see what happens and the weight gain for me is the worst I don&#039;t fit in my pants, plus need new bras."""
Levonorgestrel,Birth Control,"""I have had Skyla for about two months now. I have had spotting everyday, some light days and then experience some heavy days. It is really uncomfortable being on my period for two months now because I can&#039;t wear any of my cute undies and have to stay in these dreadful undies so my nice ones won&#039;t get ruined! As of right now, I hate my IUD. I wish I would have gotten the pill but I know I wouldn&#039;t remember taking it everyday. I hope in this next month the spotting and mild cramping goes away! Definitely going to call my doc and ask if it&#039;s normal to have your period for almost 2 months. Hope this helps some of you!!"""
Acetaminophen / oxycodone,Pain,"""I have chronic back pain.  I take this medication as needed.  This medicine has allowed me to go back to enjoying children, gardening, camping, etc.  I have small children so this medication really helps with pain while allowing me to be fully functional as well.  Doesn&#039;t make me loopy or nauseous.  This has been a wonder-drug for me."""
Iloperidone,Psychosis,"""Just recently started taking this for depression, bipolar, insomnia and anxiety. I feel so tired and groggy feeling."""
Victoza,"Diabetes, Type 2","""Didn&#039;t do bad on .06 the first week but still had a strong urge to eat. Had diarrhea and headaches. Then I started 1.2 two days ago and today I was so nauseated I prayed to vomit. Then I started vomiting and it won&#039;t stop. I take medication other than victoza every night at bedtime including metformin and a few minutes ago I threw up most of my pills from last night still intact but swollen. The food from 4 days ago smelled like roadkill. I fear how long it will be before someone dies of an overdose from old medication in their stomach not digesting in time for future doses. It&#039;s been more than 20 hours since I ingested anything but water and a vanilla breakfast shake. I will not be taking my regular meds tonight. Victoza is out!!!!!!"""
Levonorgestrel,Emergency Contraception,"""After reading so many reviews in the past couple of weeks, I felt I needed to write one given my unusual experience.  I had unprotected sex the first week of December, I took Plan B within 12hrs and felt completely fine.  4 days later I bled very heavily for 4 or 5 days, and figured I safe.  Then my period never came, took 2 pregnancy tests both were negative but I got so paranoid once I was a week late I went to the doctor and had a blood test, also negative, but with still no period and &quot;pregnancy symptoms&quot; I was still very concerned. FINALLY 11 days late I started my period.  Plan B can definitely throw your system very out of whack, so moral of the story if you&#039;re anything like me try and relax!"""
Oracea,Rosacea,"""Since I have used this medication so long, years and years, I believe it has improved my rosacea. I&#039;m not willing to stop taking Oracea to find out. As far as the stomach ache associated with this pill, I found that taking it at night prevents the stomach upset symptoms. One review mentioned burning on the lips and tongue, I have experienced this side effect very very much, however, I didn&#039;t realize this pill may be the reason. Again, if this pills causes the lips, mouth area and tongue to have a burning sensation I&#039;m not sure I would stop taking the Oracea, although that is one terrible side effect. Overall, I will continue taking Oracea."""
Ethinyl estradiol / norgestimate,Birth Control,"""I&#039;ve waited out the three month wait time of absolute hell. Since starting Tri Sprintec my anxiety is through the roof, which exacerbates my depression to the point of me having suicidal thoughts on a daily basis. I can&#039;t wait to see my doctor and switch to a new pill. At 25 yo my acne had subsided from the teenage years, but since I was started on Tri Sprintec it has come back. I thought maybe it would just come and go around the time of my period. Nope. Still here and even more coming in. I feel like I am back to being a teenager again with this acne and crazy mood swings. I am crying over anything and everything. Maybe these side effects will go away in more time but I can&#039;t handle this any longer to find out."""
Monistat 3-Day Combination Pack,Vaginal Yeast Infection,"""I read so many horrible reviews of this that I almost didn&#039;t try it. Fearing the excruciating pain described by such a majority of reviews, I tried natural remedies. I even tried the &quot;put a clove of garlic up your hooha&quot; method! None of the remedies worked.

This medication was a godsend. Please do not fear it. I experienced no pain with this, and it killed the infection dead within a day or two. I was amazed. Many people write about burning pain worse than childbirth, but I want to tell you that I experienced nothing like that. It was easy, painless, and, most importantly, extremely effective. Yeast infection is finallyour gone!"""
Venlafaxine,ibromyalgia,"""Been on this medicine for Fybromyalgia for 4 days and it has made a lot of difference already.  I am on the very low dose at the moment 37.5mg and am titrating up to 75mg after the first week. I feel sick in the morning before I eat (which I don&#039;t usually do until lunch time) but after a coffee this feeling subsides enough to manage.  I have tried about 6 other medicines over the past 12 months and the side effects of them all were intolerable.  However if I can take this medicine with the effect it has already had then I will be happy."""
Indomethacin,"Gout, Acute","""Wicked Apple was my poison( a fine ale!), after that in about 12 hours I began to hurt, and in 18 hours there was no relief in the pain.  I took my Colcrys (0.6) as prescribed, starting at 11pm, 12, and again at 2 am (about 15 hours after I had my one and only Wicked Apple)  20 hours later, it is all I can do to walk into the Dr&#039;s office still in terrible pain.  

The Dr gave me an injection of METHYLPRENISOLONE ACETATE (40mg) and prescribed Indomethacin.  By 22 hours I was feeling better, by 24 I was walking again, 26 hours I could stand in the shower.

It could have been the combination of the three drugs I have in my system, but 36 hours later, there is no pain and I only had one pill!  I still have swelling, but no pain!  Thank You!!"""
Etonogestrel,Birth Control,"""I have not gotten my period just like I haven&#039;t before which is why I decided to go on Nexplanon due to the pregnancy scares from not getting my period all the time. One thing that sucks about it is my sex drive, I don&#039;t get turned on easily and I&#039;m not  &quot;wet&quot; like I used to. I just got it about a month ago so hopefully nothing bad occurs besides that."""
Insulin isophane,Gestational Diabetes,"""I am terrified of needles and was very upset when I found out that I would have to give myself daily injections.  This pen is so easy to use.  I didn&#039;t even feel the needle.  I feel much better about the last ten weeks of my pregnancy."""
Armodafinil,Hypersomnia,"""I have anxiety/panic attacks and fibromyalgia. Fun! So, unfortunately I get sick with Lyrica at higher doses where it actually kills the fibromyalgia pain. After months of trial and errors, we&#039;ve finally found that 100mg of Pristiq, 20mg of Methadone, 225mg of Lyrica and 300mg of Tramadol is the only thing that will stop the pain. For the anxiety the Pristiq helps and also 3mg of Klonopin stops the panic (also took months of trial and error in addition to therapy). With this large amount of depressant style drugs, at times it was very hard for me to stay awake during the daytime. 150mg of Nuvigil for me has totally solved this problem. The first week I felt strange and over stimulated, and now I just feel normal and awake, from 6:00am to 10:30pm."""
Ethinyl estradiol / norethindrone,Birth Control,"""I would recommend this birth control to everyone. I have been taking it for almost two years. My periods are light and only last for a few days. My cramps are very tolerable. I don&#039;t feel unusually moody or irritable. My breasts did increase in size from a B32 to a D32. My skin is pretty clear, and I did not gain any weight. I would never switch to another birth control!"""
Gabapentin,ibromyalgia,"""Was diagnosed with Fibromyalgia at the start of the year having suffered with severe neck and upper back pain.  The deep pain especially in the upper back right in between the shoulder blades was unbearable most of the time.  I had the symptoms for over 2 years before the diagnosis and had almost 80 sessions of treatment with 11 different therapists. 

Anyway started taking duloxetine, gabapentin and Cocodamol in January.  Started gabapentin at 300 mg a day and built up to 1800mg a day by the end of March.  Over the last few weeks I feel that I am starting to get my life back.  Not totally pain free but I now have spells where the pain is bearable.  So if you have just started on this,  be patient and fingers crossed you will get relief."""
Levonorgestrel,Birth Control,"""I just got my second Mirena inserted today - I will seriously never do anything else.  I&#039;ve tried other methods (patch, NuvaRing, pill) and nothing compares to Mirena if you want longer-term birth control!

Yes, it is fairly painful upon insertion, but it lasts for only about 40 seconds max, but it is so worth it!  Both time I didn&#039;t have bleeding or cramping afterwards.  My first time I didn&#039;t even have spotting, my periods just completely stopped for all 5 years.  I am crossing my fingers for the same this time!  I never had weight gain and my skin was amazingly clear.  For those who are interested in low-maintenance, long-term birth control, I cannot recommend Mirena more!"""
Ambien,Insomnia,"""I began taking Ambien 15 years ago I stopped it while I was pregnant with my first child and then ended up going back on it from lack of sleep for so long. I took it again first time 6 1/2 years before becoming pregnant again and then had to stop it. When my youngest son was a year and a half old I started taking it again because I could not sleep longer than an hour.  When I first started taking Ambien I think the chemical compound was a different because back then I would eat in my sleep, cook meals in my sleep, but then after going off of it and going back on it I believe the formulation changed. I have not had any of those issues for over 13 years. Taking it on empty stomach makes a huge difference."""
Belviq,Weight Loss,"""Belviq simply killed my appetite, especially the urge I have to snack in the evening. I&#039;ve lost 14 lbs in almost 4 weeks and I&#039;m well on my way to lose 30 lbs. I sleep much better too. I don&#039;t know if that&#039;s from Belviq or less snacking in the evening but it is a fact."""
Levaquin,Pneumonia,"""This drug is GARBAGE and should be taken off the Market. I was hospitalized with pneumonia. The doctor prescribed it for me when I was released from the hospital. It has destroyed my appetite as well as my stomach. I can&#039;t sleep. I am nauseous every day. I have 2 more doses to take. I decided not to take them. I can&#039;t tolerate all the side effects."""
Suprep Bowel Prep Kit,Bowel Preparation,"""It tasted horrible. It did produce the expected outcome but I started vomiting and hour after each dose"""
Accutane,Acne,"""I&#039;ve had acne for about 8 years. Last year it suddenly deteriorated into severe nodular cystic acne. I started Accutane in September 2016, I&#039;m nearly finished my sixth month and I still have the same nodules and cysts that I had at beginning of the treatment, I&#039;m still breaking out the same as before. Accutane is effective for 96% of people whilst they&#039;re on it, so I&#039;m not bashing Accutane, it&#039;s an amazing drug for the majority of people. I&#039;m obviously an exception and I&#039;m devastated."""
Plan B,Emergency Contraception,"""I had unprotected intercourse twice within the range of the 72 hours. I asked a friend of mine who has used Plan B and the morning after I purchased Plan B for $41.80 (price is after taxes). Came home, took them, felt fine. No side effects. I was supposed to get my period 3 days later but I didn&#039;t. I got minor cramps here and there but nothing too severe. Now exactly a week after I took them I got my period (5 days late). This pill works but I never ever get severe period cramps. My period cramps this time are very severe and painful to the point where I can barely move. This has never happened to me before and I hope it lightens up in the next couple of days."""
Bupropion / naltrexone,Obesity,"""I have been on CONTRAVE now for 6 months I think.
Working but not as potent as in the beginning.
Exercising moderately as well.

It was covered by my insurance but no more. I have lost 31 lbs.
Still,I can&#039;t stay on this med forever.
Very expensive when paid out-of-pocket.
I will try it one more month and then get off it.
Side effects are still some dizziness and  intermittent nausea."""
Contrave,Obesity,"""I started march 18 slight headache but it sure did curb my appetite.I wasn&#039;t hungry but i sure thought n talked about food n soda how I want to indulge but didnt ,couldnt contrave wouldn&#039;t let me.Until this evening I was doing well I was on a no carb low fat until I ate a sandwich, feeling guilty. But you know  what I didnt binge I didn&#039;t even drink that ice cold pepsi I kind of feel good Maybe my body needed the sandwich .Its way less food I&#039;ve been eating I do recommend contrave. Week 2 soon I will keep you inform . I also had a gastric bypass and gained 40 lbs back. But now I&#039;m on my way to good health"""
Xyrem,Narcolepsy,"""When taken as prescribed medications works well for restful sleep."""
Cephalexin,Bacterial Infection,"""I use the Cephalexin to treat the absessed teeth i have.  I have used it before with UTI&#039;s.  I am allergice to PCN and my doctor perscribed the Cephalexin said that people that is allergic to the PCN can take the Cephalexin and it does the same job as PCN does."""
Depo-Provera,Birth Control,"""In the beginning I had bad headaches, vomiting &amp; non stop periods. Now after 12 months of this the only issue is weight gain. But having a small stomach I only gained 5 pounds. I have gained and lost (w/o exercising). I would say this is really effective but with side effects not so much. I went to see my doctor about my periods last time I went in she said if it doesn&#039;t stop after this cycle I should change birth controls. And is has she was right! If you think you will stop your periods so soon stop assuming and give depo a try! Its super effective and I&#039;ll definitely continue using it!"""
Relpax,Migraine,"""Relpax 40 mg is my go-to medication when I have a bad migraine.  I have tried almost all triptans, and this works best for me.  If taken ASAP, it typically zaps my migraine within 60-90 mins.

Relpax makes me feel spacey, &ldquo;floaty&rdquo; and tired so I usually take it and then lay down for a nap.  The side effects disappear within an hour or two.  This seems to be stronger than Imitrex (sumatriptan) or Maxalt (rizatriptan).  Not sure if it is actually stronger or just works better for me.  It is quite expensive, even with insurance."""
Skyla,Birth Control,"""I got the Skyla inserted a week ago and it was pretty rough. The actual process of getting it in did not bother me but after I had awful cramps, felt nauseous and lightheaded. The cramps have not gone away but have lightened a little bit. The doctor said I was feeling pain because I have a &quot;sensitive uterus&quot; and have never had kids. Haven&#039;t bled at all though which is nice."""
Glatiramer,Multiple Sclerosis,"""I was diagnosed July 2012.  Finally!  I could no longer walk, my legs had gotten so weak.  Was in a wheelchair already.  PPMS is not fun.  I have noticed that my legs are stronger, but still not able to walk.  And my MS has not gotten any worse.  Don&#039;t have and have never had &quot;flare ups&quot; but at the rate I was going downhill before Copaxone, this is great.  I don&#039;t like the shots, but I know they are worth it."""
Miconazole,Vaginal Yeast Infection,"""HORRIBLE
This product should be recalled
I&#039;ve used it before with no issues but this time around---- are the ingredients different ?? EXTREME BURNING AND ITCHING!!
I should have waited to see a doc and take a pill !!!!! It&#039;s almost 1 am and I can&#039;t sleep :((("""
Levonorgestrel,Emergency Contraception,"""I took Next Choice about 4 hours after having unprotected sex with my husband. I also followed another users advice and took Dramamine about an hour before I took the pill in order to combat any nausea. After taking the pill I only felt slight amount of nausea, but it sure did wipe me out. I took the pill on a Sunday and slept all the way until Monday evening. Some side effects that I got were: major bloating, abdominal cramping for more than a week, slight headache, extreme fatigue, very heavy menstrual flow 4 days after taking the pill, mood swings, extreme hunger, breast tenderness, swollen ankles.... but other than the many side effects experienced, I am satisfied with this medication for preventing an unwanted pregnancy."""
Desvenlafaxine,Anxiety,"""I have been on Pristiq for 11 days after switching from Paxil 12.5 CR.  I feel like I&#039;ve been on a roller coaster ride.  Agitation, shaky, anxiety and emotional. The nausea and headaches are gone now but I&#039;m thinking this is not the right medicine for me.  I will give it 14 days and if there is no improvement I will get off them. Not sure what I&#039;ll try next. The doctor thinks Wellbutrin. """
Trulicity,"Diabetes, Type 2","""Just took my 8th injection of .75 Trulicity today.  It has been amazing.  I always had trouble with my sugars and would get horrible welts from Levemir.  Doctor switched me from Levemir to Tresiba (62 units each morning) and the difference has been amazing.  I have GERD so all I can report is that it definitely has not been worse.  My sugars used to run around 230 to 323 most of the time.  Now they are from about 65 to 130.  If I&#039;m under 80, I don&#039;t take any short-acting, which is Novolog for me.  I&#039;ve lost about 7 pounds and my cravings are a thing of the past.  I am on SSDI and with prior-authorization from my endocrinologist, Medicare has authorized payment.  If it ever doesn&#039;t, Trulicity and I will part ways."""
Drixoral Cold and Allergy,Sinus Symptoms,"""Drixoral worked. Nothing in the drug store works like drixoral did.  I&#039;m tired of trying different brands to find what works because nothing does.  If there is such a demand for it to come back then bring it back in its original potency but have it be prescription only PLUS patients must have a documented chronic sinus condition"""
Adipex-P,Weight Loss,"""I started taking this medicine 03/08/10 at 215lbs..today is 04/14/10 and I am at 195lbs! Total loss of 20lbs in a little over a month.  I have been watching my calorie intake around  1000-1200 a day...and exercise at least 4-5 times a week (30-45 minutes each workout). During Easter I ate Easter dinner with the family and believe in having what I call my &quot;cheat day&quot; once a week.  I avoid fast food @ all cost excluding Subway and Wendy&#039;s where I can eat delicious low fat/low calorie food. One of my biggest weaknesses is sweet tea...I have switched from regular sugar to Splenda and I have adjusted well to the change. This medicine works, it helps me keep focused on my goal..30-40 more lbs to go!"""
Doxycycline,Acne,"""I took doxycycline for one month exactly and it honestly did my face wonders! My doctor had it combined with 3%/5% benzamycin top gel, but I managed to finish the gel in 2 weeks or less because my break outs were bad and that would make them go away by the next day. Now the doxycycline has helped A LOT with the break outs not appearing on my face. I&#039;m 20 years old and got the pills prescribed to be taken once a day every day for a month and now I haven&#039;t broken out since I started. I&#039;m a girl and whenever I got my period, I would break out pretty badly, but this medication has helped A LOT with that. I will ask for a refill on both medications. Highly recommend to give them both a try."""
Victoza,"Diabetes, Type 2","""My doctor suggested victoza. The biggest side effects are constipation and upset stomach.  I burp and have gas a lot. My appetite is gone and I can&#039;t eat as much. I fill up quickly. I have only lost a few pounds but I am only 17 pounds overweight. I will stick with it. My fasting sugar numbers have been between 100 and 115. I will stick with it."""
