name_of_drug,use_case_for_drug,review_by_patient
Etonogestrel,Birth Control,"""I got nexplanon July 8th of this year it has been a living hell I been bleeding continuously off and on spotting.  It also has given me the worst acne EVER my face will clear up and then a day or two later come back! I also have experienced pregnancy like sypmtoms such as nausea, and sometimes actually vomitting! I also have the worst headaches and sleeplessness. I would not recommend this product to anyone! Its not worth it try condoms or abstinence"""
Evekeo,ADHD,"""The only ADHD medication I have taken that doesn&#039;t have awful side effects. It makes you more alert and productive with out the headaches and and hungover feeling that I get with adderall and focalin. I don&#039;t think it effects everyone the same but it has been a real lifesaver for me."""
Sulfamethoxazole / trimethoprim,Urinary Tract Infection,"""I have a severe allergic reaction. I had extreme rash, with blisters all over my body, including the inside of my mouth. This happened after taking it for three days. It wasn&#039;t a positive experience."""
Buspirone,Anxiety,"""I suffer from severe panic attacks. This medicine left me on the couch for a week because I felt so dizzy. My vision is also &quot;snowy&quot; from this medication and still has not went away 2 years later. """
Levothyroxine,Underactive Thyroid,"""I&#039;ve been on this drug since I was diagnosed with hypothyroidism at around twelve years old. It hasn&#039;t done anything especially dramatic or life changing. I am able to lose weight and I am not tired and sluggish. I don&#039;t believe I have experienced any of the known side effects. This drug works for me, that&#039;s all I can ask."""
Viibryd,Depression,"""I suffer from depression. I have been on Viibryd for 3 months. I take it at 6pm daily, and I&#039;m on 40mg/day. I previously failed Celexa, Lexapro (allergic to Lexapro), and Wellbutrin. I love Viibryd- My moods are improved, I&#039;m slower to react to angry situations, and I&#039;m sleeping better. I&#039;m noticing a nice boost in my libido. One small side effect I have is that I get what is called &#039;brain zaps&#039;. It just feels like someone is shocking my head. Quick, kind of annoying, but tolerable. I get this sometimes right before I take my daily dose- like the medicine is &#039;wearing off&#039;."""
Phentermine,Weight Loss,"""I started using another weight loss medicine on March 24th.  The first 60 days I lost 22 lbs.  During the third month I was not seeing any changes and switched to Adipex-P. I used Adipex for 45 days and have lost an additional 10-12 pounds. I did not experience any of the side effects or jitters except sleeping.  I tend to only get 6 hours of sleep a night."""
Contrave,Weight Loss,"""I asked my doctor to place me on Contrave because I had hit a wall with my own dieting and exercise. I was also looking for assistance to reduce/eliminate my alcohol intake. (I&#039;m a weekend warrior in my socializing.) I have been on Contrave for a week now. I lost 7lbs in the first 5 days. I workout with a personal trainer 4x per week. I cut caffeine and alcohol from my diet due to the headaches. I don&#039;t even crave a drink! I&#039;m starting week 2 with the pills. As of 7.21.17 I weigh 164lbs at 5&#039;9. My goal weight is 140lbs. I gave Contrave 9/10 only because of the headaches,  which are minor. I&#039;m very happy with my results thus far and my trainer is blown away! I&#039;m getting weighed in this Thursday again. I&#039;ll check back in after."""
Miconazole,Vaginal Yeast Infection,"""As I lay here weighing the benefits of clawing the inside of my own vagina vs. continuing to let the medicine take effect, I wish more than anything i never inserted this devil cream inside my body in the first place. This is night one for me, and I&#039;m just going to tough out the YI and not use it again. EVER. I can&#039;t do another night of this. The mild itching I had before is NOTHING compared to the itching I have now. If there were sandpaper near me, I would use it. Repeatedly. Inside and out. I can feel my heart beating in my vagina. That&#039;s the pain I&#039;m feeling."""
Loestrin 24 Fe,Birth Control,"""I started Loestrin 24 to regulate my periods. But I didn&#039;t like being on the pill, I gained weight, had mood swings, and lost my sex drive. I always felt bloated and it was so uncomfortable. The only good thing that came from taking this pill was that after I stopped taking it my periods stayed consistent."""
Lamotrigine,Epilepsy,"""I have complex partial seizures. After trying 17 different drugs. Yes,17.  I basically had to sign my life away into to be part of a drug study on lamotrigine when it had not been approved by the FDA yet. I take 300mg x 2 daily. I rarely have a seizure. (I do take it Tranxene with it as well). I now have been taking Lamotrigine since about 1987. The only problem was getting me on the right dose. I am happy as a clam."""
Trintellix,Major Depressive Disorde,"""I started on 10mg of Brintellix about two weeks ago after being taken off of Wellbutrin and Celexa. Right away I started to feel physically ill. Horrible headaches, sour stomach, extremely agitated and tired. I don&#039;t know if it&#039;s withdrawals from the other medicine or effects from starting the Brintellix. I am leaning towards the latter though. I just took my medicine and only an hour later I am feeling very ill again."""
Guaifenesin,ibromyalgia,"""I have been using guaifenesin as a treatment for the reversal of fibromyalgia symptoms for 4 years. As an RN, I was very skeptical since there aren&#039;t any positive studies done for this purpose. I had suffered with fibromyalgia symptoms for 12 years, was nearly bed bound, and was researching electric scooters. After relocating to Hawaii, I met an RN who leads a fibromyalgia support group focusing on utilization of guaifenesin. Having nothing to lose by trying this treatment, and trusting a fellow RN, I began the protocol. 4 years later I&#039;m walking a mile daily, cleaning my own home, engaging in multiple craft activities (ceramics, sewing, painting, and gardening), swimming, and enjoying life again. This has given my life back."""
Linaclotide,"Constipation, Chronic","""Took one Lizness and 30 minutes later had massive cramping from my stomach and intestines. If I even took a sip of water it got worse. Rolled up in a ball crying all day, no one, not the doctor or pharmacy had any idea of how long it would last. Best guess was 24 hours. It stopped at 9pm for the most part and started at 5.30am. Today my entire body is sore to touch, bloated and horrible stomach ache. Can&#039;t eat anything. """
Plan B,Emergency Contraception,"""I took the pill four hours after sex and a few weeks later found out I was pregnant. So for me it wasn&#039;t effective at all. Also, as it warned me on the box I almost vomited, luckily I didn&#039;t but it was a close call."""
Carbamazepine,Epilepsy,"""This is the only medcine I am allergic to.  Extreme itching!  I couldn&#039;t stop taking it too fast.  Luckily,  it doesn&#039;t have a very long half life."""
Bupropion,Depression,"""I had a SEVERE ALLERGIC REACTION TO THIS MEDICINE."""
Diphenhydramine,Nausea/Vomiting,"""I get severe migraines and was given this in the hospital instead of traditional nausea meds. It work well and I now use it at home and actually works better than Zofran or Phenagren."""
Citalopram,Depression,"""I&#039;ve been taking 10mg of citalopram everyday now for 7 days and then had to up it to 20mg after that. Have never felt so rough! Those first 7 days were hell for me, really bad headaches sickness and very bad depression that felt worse than what I had to begin with! I hadn&#039;t been able to eat anything either 4 or 5 days into it, but i tell you now the first day I took the 20mg start of week 2 absolute different story. I&#039;m like a different person. Please stick the first week out as that was the worst for me it does get better I promise. Stick it out I nearly didn&#039;t but so glad I did now! i feel brilliant now. These tablets do work but give your body time to accept them and you&#039;ll reap the benefits. Be strong and stick it out. Tomorrow is another day :)"""
Oxcarbazepine,Bipolar Disorde,"""Works pretty well for stabilizing moods, mostly manic. I take 300mg morning and 600mg at night. Have been taking for about three years. Dr will not let me take more than the 900mgs. Headaches for a week when starting and during increasing dose. It does mess with my memory. I can forget asking someone a question three times and sometimes have some trouble remembering words I&#039;m trying to express."""
Metronidazole,Bacterial Vaginitis,"""I am currently taking the twice a day 500 mg tablets and I can&#039;t explain how happy I have been and how comfortable I feel now that my infection has cleared up . The pills for me worked rather quickly by the third day I was clean. I don&#039;t mind the awful taste of the pill if it&#039;s going to work , what I do is either open my mouth wide and drop it at the end of my throat or put it inside a small piece of food and swallow. I also get dizzy at times but as long as I drink water it goes away . I experience bloating and I&#039;m gaseous but it&#039;s nothing I will stop my treatment for. And it is true please DO NOT DRINK ! The first day i took them I forgot the doctor said not to drink and i felt right away stomach cramps and dizziness ."""
Levitra,Erectile Dysfunction,"""Have been experiencing mild Erectile Dysfunction for several years, but never been a major problem until recently. Mainly because of a high stress level with work and some other things. My doctor gave me a prescription for 20 mg Levitra. I didn&#039;t feel like I needed the whole 20 mg, so I cut it in half. I took it about an hour before bedtime, and just a few minutes later I could feel it kick in. We went 2 rounds last night, and I could have gone a few more, and I&#039;m still feeling it working this morning. The only side effects was some stuffiness but nothing too bad, and a mild headache that went away with some aspirin. """
Clindamycin,Skin or Soft Tissue Infection,"""I got pseudomembranous colitis from this medicine but it put my MRSA back into being dormant."""
Tradjenta,"Diabetes, Type 2","""I have been on Tradjenta for 90 days. I have gained 13 pounds, my daily fasting numbers are up by 20 points, my joints and back ache regularly, I have diarrhea several times a day and I have no energy. Today I called my doctor with all of these side effects and he told me to stop the medication and keep track of my daily fasting blood sugar. Wish I could do it on my own, with NO drugs!!!"""
Ethinyl estradiol / levonorgestrel,Birth Control,"""I&#039;ve only been on this pill for two days... That&#039;s why I gave it 5 stars and I know it&#039;s a bit rushed but oh boy. I&#039;ve had an insane head ache all day. I also feel very nauseous, like I could throw up any minute. My heart is also pounding pretty fast and hard. Not sure what that&#039;s about but if it doesn&#039;t fix within a month I&#039;ll definitely be discontinuing this brand."""
Arimidex,Breast Cance,"""I have had minimum side effects."""
Acetaminophen / hydrocodone,Pain,"""I have been taking Norco for about a year now and it works for me with very little if any side effects. I had surgery on C2-C3, C3-C4, C4-C5, C5-C6. The surgeon wants to cut again on C7. Had a plate with screws put in neck in 2006. I have Degenerative Disc disease with severe bilateral neuroforaminal stenosis. I take 10/325 of Norco three times daily and it helps the pain and is keeping me from surgery on C-7. Only 30% of all neck surgeries are successful and will stay on Norco to prevent surgery as long as it works and for now it is working, with no side effects."""
Nexplanon,Birth Control,"""For me this was the worst control ever. I got this implanted after I had my daughter she is 15 mouths so about 14 months now. This is the worst thing that ever happened to me. I was 128lb post partum and I am now 150 and I&#039;m only 4&quot;11 so I look huge. I have always been small. My vision is effected, no desire to have sex even tho I love sex. Mood swings I&#039;m always crying or angry. I&#039;m always in a fog. Sometimes I feel like I&#039;m not even living. I&#039;m very tired. In order to do anything I have to drink and energy drink and I&#039;m so fatigued that the energy drink only makes me feel like I&#039;m well rested not jacked up on energy. When I get a peroid it is crazy long. Works for some but its not worth the side effects."""
Ascorbic acid,Dietary Supplementation,"""Great immune booster."""
Yaz,Birth Control,"""I got on this birth control when it first came in 2006 when I was 16, I was on it up until I was 22. Switching was the biggest mistake ever. I LOVED this birth control. I never had any problems with it. Lighter and shorter periods, cleared up my skin and no bloating or weight gain. The only downfall was I did get very emotional but that was it and maybe occasional breakthrough bleeding. Best of all it worked for me. I am switching back to this birth control and can&#039;t wait."""
Insulin degludec,"Diabetes, Type 2","""MY experience has been amazing I started on lantus and progressively my A1-C kept getting higher 100mg of lantus and slidin scale of novalog easily for ten year&#039;s . So I talked to my doctor and asked her to try teojeo with me that didn&#039;t help either my A1C was at an 8+. Two month&#039;s ago I started tresiba my A1C after two months dropped to 7.1 and I lost 16.4 #s . MY attitude my energy has increased I&#039;m feeling a 110% better all in two months. I&#039;m glad the rep talked to my doctor about this med it&#039;s been a life changer."""
Clarithromycin,Sinusitis,"""Clarithromycin seems to be quite effective with sinusitis. I hate the side effects though.  This antibiotic produces a bitter/metallic taste in my tongue. I haven&#039;t experienced diarrhea, but I now poop once in the morning and once in the evening. I used to poop once a day before taking this antibiotic."""
Zofran,Nausea/Vomiting,"""I&#039;ve been dealing with extreme nausea and vomiting for the past 6 months, and it finally got to the point where I couldn&#039;t take it anymore and went to the ER. They gave me Zofran through IV and was feeling better in about an hour. After I was released I was on 4 mg every 8 hours and for about a week I was back to my old self. Then things started to go down hill, and they boosted it to 8 mg. Now it doesn&#039;t evenwork anymore and makes me more nauseous than I was before. I also got pretty bad constipation and headaches after taking the medication. Not to mention, if you&#039;re taking the tablets be ready to handle the taste because it is DISGUSTING."""
CellCept,Systemic Lupus Erythematosus,"""Taking 2000mg a day with mild side effects.  Tremors in my hands when I first started and when the dose was increased.  Those have since stopped.  Also experience some sleep problems, but this could also be due to another medication.  My body responded very well to the medication and my condition has significantly improved in just a few months.  Hoping for continued success on the medication."""
Klonopin,Anxiety,"""This is the drug that was a total game changer for me. I was on effexor and abilify because of severe depression and suicidal ideation (at only 19 :(). While the abilify and effexor helped with the depression, I was extremely anxious, jumpy, panicky, and unable to sleep at all. Klonopin changed all that. I am now able to do anything with no anxiety, no intrusive thoughts, and am visibly much less tense and more relaxed than I have ever been. I can go to work, take public transport, and interact with customers with absolutely NO anxiety anymore. If you sound like me, I highly suggest at least giving this medication a try. It saved my life."""
Bisacodyl,Bowel Preparation,"""Had a little stomach cramping and nausea just as with any other laxatives I&#039;ve taken.  I&#039;m very satisfied though because it really cleaned me out.  Exactly what I wanted!!!.  Thank you!!!"""
Mirtazapine,Obsessive Compulsive Disorde,"""I tried this after Citalopram quit on me after about 5 years. What an awful drug for me. It did little for my anxiety and OCD. Some OCD symptoms actually worsened and weaning off it caused extreme anxiety to the point of panic attacks. I&#039;m finally off it after the final rude downshift and am trying Zoloft with good redults so far. Good riddance to bad rubbish."""
Suvorexant,Insomnia,"""Nothing at all. I am writing this after taking 15 mg dosage. Was on Ambien generic 6.25 mg and it worked great. Then my pharmacy started using a different Ambien generic that had no effect whatsoever. Instead of just changing to the name brand my doctor gave me samples of Lunesta. I am having the same results as the 2nd Ambien generic. Calling doctor in the AM and requesting something else."""
Clonazepam,Bipolar Disorde,"""I have bipolar 2 with rapid mood cycling occasional suicidal ideations.  After taking citalopram for 12 years for what doc thought was regular depression, I went off that and now searching for mood stabilizer for bipolar moods. 
 Clonazapam 0.5 2x daily helped stabilize my anxiety after all of this and Ativan 0.5 as needed for panic attacks.  Clonazapam is great because it stays in your system much longer than Ativan.  Overall, Clonazapam is a life saver for me (especially at time with PMS moods!)  Still searching for a good mood stabilizer bc I still have &#039;bad&#039; days though but always stay POSITIVE THIS TOO SHALL PASS keep going to your doc and psych!  Peace."""
Phentermine,Weight Loss,"""I have to agree with everyone here. I was prescribed this medication years ago and I lost 2 sizes, got down to a size 10/12 and kept it off for 2 years until I got pregnant with my son. My only side effects were dry mouth, not always wanting to sleep (because I took them too late sometimes) and extreme energy! It was the best medication for weight loss I&#039;ve ever used and now I&#039;m looking to lose the weight again. Although just a note to everyone, if you are going to do something like Ionamin, it&#039;s best to exercise with it...that helps to keep it off. I&#039;m going to see my doctor/nutritionist next month!"""
Medroxyprogesterone,Abnormal Uterine Bleeding,"""I have been on the depo shot since I had my daughter which was 3 years ago. For the first few months I had spotting but that stopped. I still get PMS-like symptoms around the time I would usually get my period. I have gained 15 pounds while on depo. I have been getting bad migranes &amp; terrible aches in my body and I&#039;m not sure if it&#039;s because of the shot. I would definitely recommend this shot. There is nothing to remember every day, just show up to the doctor once every 3 months!"""
Ethinyl estradiol / norgestimate,Birth Control,"""I was switched to this from Loryna (generic Yaz) two months ago. I&#039;ve been on some form of BC since age 19 to control horrible cramps and prevent ovarian cysts, and I&#039;m 27 now. Hoped this pill would lessen the ovarian tenderness and stop the weight gain (40 lbs in one year!) I had while on Loryna. Well, I&#039;m horribly gassy and have had diarrhea every day for going on three weeks now of my 2nd pack. It&#039;s clearing up my acne and sex drive is better by a smidge, but my period is a lot longer and heavier, rather than shorter and lighter like it was on Loryna. Cramps are much worse, too, and I feel tired all the time. The crazy appetite increase Loryna gave me hasn&#039;t changed, either. Calling my gyno today to see if I can switch."""
Miconazole,Vaginal Yeast Infection,"""I&#039;ve had my fair share of YIs, and I&#039;ve always used monistat without any major problems but I was on some antibiotics for a few days and as soon as I left the doctor I had this horrible gut feeling that I should&#039;ve asked for a script for diflucan while I was there. I was so uncomfortable and I dished out almost $20 on monistat to basically torture myself. Made my &#039;uncomfortable&#039; YI a living nightmare. Burning, pain, and excruciating swelling. Sitting hurts, wiping myself after peeing hurts, walking hurts. Got my hands on diflucan but now I&#039;m sitting here playing the waiting game wondering why I couldn&#039;t just wait a few more hours instead or why I didn&#039;t google it before I bought it. Didn&#039;t even know a YI could be this painful. Awful"""
Oxycodone,Pain,"""I&#039;ve been on Roxicodone for about two years now and this is the ONLY short acting medication that has worked.  I have been through all the short acting or break through medicines and Roxicodone is by far the greatest.  I am on high doses due to having gastric bypass and not absorbing as a &#039;normal&#039; person would.  I need to have my tailbone removed as it&#039;s broken and swinging around back there.  Not to mention it&#039;s broken at a 90 degree angle or angulated.  INSANE pain. """
Norethindrone,Birth Control,"""I started using Lyza and it has being 2 months. THANK YOU FOR THIS BIRTH CONTROL! I am 23 and its my first time using birth control. I was really scared to get on any kind of birth control but after two babies, it was time to think of it and to take it seriously! I went to my OBGYN and she recommended this pill and it is going pretty well. I get a little bloated after I take it but drinking lots of water makes it a lot better."""
Oxycodone,Chronic Pain,"""I have to laugh when I read some of these comments . Why do I itch ? Because you are taken too much ! Listen I take 7 pills a day of oxycotin 80 mgs and 15 pills a day of roxy 30mgs because a doctor years ago decided it would be the best thing for me and it was the worst thing he ever did to me . I take over 210 80s a month and 450 30s that&#039;s is 660 pills a month yes one month !  I would tell anyone do not take these meds I am so addicted to these now and now with Obama and the DEA against them doctors are being told to take ppl off them well that&#039;s great now I deal with the withdrawal and it&#039;s terrible please please please if you really need the meds take them with caution they become so so addictive doesn&#039;t matter who you are"""
Levonorgestrel,Emergency Contraception,"""I promised myself I will leave a feedback here if the pill works! Here I am, on the first day of my period! I would say this pill really made me emotional unstable. I freaked out, cried and worried a lot after I took the pill. So I started to look for more information online, and it didn&#039;t help at all. Do NOT search for more information! Just relax, try not to think about it and the pill will do its work!! I was so close to my ovulation day which is why I was so worried! I&#039;m so happy the pill worked! Good luck everyone!"""
Propranolol,Anxiety,"""I&#039;m 26 year old male, I used to lead a party animal life i.e. Alcohol, etc. I thought I was invincible through my teens then after 16 years abuse I woke up one morning and felt like I was having a heart attack flared up in the face, tingling down my arms, lack of breath, confusion, hot and cold sweats happened quite often on a daily basis so I went into hospital, did an ECG on my heart then the doctor said you are having panic/anxiety attacks. The flashbacks of my past triggered it. I&#039;ve been put on 80mg slow release beta blocker they work great for me never had a panic attack since. """
Fluticasone / salmeterol,"Asthma, Maintenance","""I&#039;ve been on Adviar for more than 2 years and have had no problems with it.  My asthma developed because of my newly discovered allergy to cats and it has allowed me to keep my pets without any breathing issues.  It did give me some heartburn at first but, since I was overweight, I lost 20 pounds and that seemed to do resolve the heartburn issue."""
Toradol,Pain,"""Presented with sever pain in my left rib cage. This pain started after I bent over to pick up something out of the ocean. Felt a pop which caused sever pain under my left rib cage. Breathing, moving, walking, getting up and down all caused sever pain that made me cry out. On the forth day I finally went to see if a th was broken. The Doctor ordered X-rays and gave me a shot of Toradol in the hip.  Also gave me a script for Percoset which I have not taken yet. Within an hour I had some relief from the pain and was able to breath with only moderate pain. It is now 8 hours later and I still have only a little pain.  So thankful for this medication."""
Levonorgestrel,Birth Control,"""All bodies are different! I had Skyla inserted last month on the 18th and its been about three weeks with it in. The insertion was definitely painful but nothing that can&#039;t be handled in the 5-10 minutes the procedure takes. I had read a lot of scare stories previous to going. I unfortunately had mine inserted a week before my period. The cervix softens during your period which is the recommended time to have it done. I spotted with little to no cramping for the first 2- 3 days and got my period a couple days later as well. I had some pretty severe cramps on and off the first day or so into my period. It almost feels as though your body is trying to contract it out. My period lasted a little longer but has stopped with no spotting at all."""
Seroquel XR,Bipolar Disorde,"""Been on Quetiapine MR for around 9 months. 300mg at night. Found it far less sedating than Olanzapine. Its been a miracle for my Bipolar, absolutely no depression and no manic episodes. Yeah I put on weight but the effects on my mood and mental health have been incredible."""
