name_of_drug,use_case_for_drug,review_by_patient
Tioconazole,Vaginal Yeast Infection,"""It was my first time having a YI this week. So I bought monistat day 1 and used it last night before bed. I read the reviews about how it burned and itches for hours but I didn&#039;t have that experience lucky for me. When I woke up the next morning not only was my YI not treated my entire &quot;area&quot; was swollen and in a little pain if I touched it. It hurt to walk but I made it to the doctors as soon as I got up and my doctor diagnosed me with a YI and prescribed me &quot;fluconazole&quot;. I&#039;m hoping it works better than monistat did but I will never use that product again. And my biggest advice to anyone out there who has a YI you should go to your doctor instead of trying to cure it yourself. Or use anything BESIDES MONISTAT!!"""
Zyban,Smoking Cessation,"""Smoking @ 16 for 41 years, had in that time 2 dvt&#039;s. Stopped after first day on Zyban, never touched tobacco since.
Fabulous product."""
Ethinyl estradiol / norgestimate,Birth Control,"""I love Mononessa. I used to have extremely painful cramps, I would have to miss work and school because I was in so much pain, and  Mononessa has definitely helped. At first it didn&#039;t seem to help with the cramps so I went back to my doctor and she uped my dosage. My periods come on the exact same day every month which is really nice. I definitely don&#039;t have as heavy of a period and it normally lasts 3-4 days. I do seem to be a little more emotional the week before I start but I never had any weight gain/loss issues with it."""
Nexplanon,Birth Control,"""I was on Nexplanon for less than 3 months, bleeding was light but periods lasted for weeks, no weight gain but was unable to lose weight. Dieted, workouts, and even saw a personal trainer yet nothing. I became very hormonal, depressed, and constantly tired. I just had my implant removed this afternoon. For me, having to take a pill everyday is much better then the side effects of Nexplanon."""
Levonorgestrel,Birth Control,"""I got kyleena inserted today. Let me tell you whoever said slight cramping is crazy it was the worst pain I have ever felt. It was the last day of my period so I wore  a pad and only had only a few drops of blood, after I got it inserted I was gushing. It&#039;s been about 5 hours since it&#039;s been inserted still having slight cramping but nothing as bad. I&#039;m going to wish for the best no babies for me!"""
Levitra,Erectile Dysfunction,"""I&#039;ve tried all of the big 3 multiple times and Levitra is the clear winner. Cialis doesn&#039;t give the rock hard results that Viagra and Levitra do and you get a headache for it. Levitra works faster than Viagra and definitely lasts longer. On an empty stomach I&#039;m ready to go in twenty minutes and can go even the next day on the same dose with Levitra. Viagra works but takes 30 minutes at least and sometimes longer to get results. You have maybe three good hours with the Vs."""
Contrave,Obesity,"""I tried Contrave and could not stand the nausea and vomiting. Sick to my stomach. I didn&#039;t appreciate the side effects really. """
Adipex-P,Weight Loss,"""I&#039;ve been on phentermine since Sep 2, 09. I was 291lbs. today, still taking it, I&#039;m 248lbs.That&#039;s a loss of 43lbs &amp; there are no words. For about 6 weeks I didn&#039;t take the drug because of certain reasons. Coupled with exercise, running 1.5 miles 3-4 times &amp; doing Zumba 4-5 times a week &amp; watching what I eat. I see the results &amp; I&#039;m very proud. I&#039;ve found that phentermine is not meant as a simple, quick fix, but is to help change your body AND mind so that you can maintain because a change of mind has taken place once you are off. I suggest exercising when you start taking it because the weight will come off even if you do nothing, and that can be deceiving in that you won&#039;t think you have to work as hard and you&#039;ll gain it back plus some when you stop."""
Docosanol,Herpes Simplex,"""I am on my 2nd day using Abreva&reg;, so far so good. I like how it numbs the area and stops the Itching. Very Relieving! In regards to &quot;quicker healing&quot;, It has helped in avoiding a larger breakout. My breakout isn&#039;t as big and nasty as it gets without treatment so I am pleased so far, some things work different for others so I can only speak for myself but it never hurts to try!"""
Acetaminophen / dexbrompheniramine / pseudoephedrine,Allergic Rhinitis,"""I have used Drixoral for years and it is the only one I really get relief from.  I am very upset it is not on the market."""
Etonogestrel,Birth Control,"""I&#039;ve had Implanon for about4 years now. I just got it reimplanted. If I recall correctly you do spot the first year or the first two years. I just don&#039;t remember spotting as much the third year. Your mood may change a bit. You may get some acne. You also may gain some weight. I don&#039;t know how it affects my sex drive. This is what I&#039;ve experienced. HOWEVER, in comparison to other birth controls, this one is great. The bloating and backache that I got when I was on my period is nothing compared to the small bloating and backache you may get when on this. I get no cramps or fatigue. Depo Provera gave me hot flashes. The NuvaRing kept falling out."""
Nortriptyline,Migraine Prevention,"""I found the taking nortriptyline was very helpful especially when your head is hurting beyond a 10 . When your in need of some super relief in minutes. """
Bupropion / naltrexone,Obesity,"""I am a 35 year old woman who has been fighting with my eating issues since I was a child.  Thanks to this medicine for the first time in my life I am not compelled to finish my plate and am perfectly happy sticking to a 1200-1500 calorie diet.  I finally know when I&#039;m full from eating. I have had zero side effects from contrave.  No nausea, no constipation, and thankfully no seizures.  I had decided along with my doctor that the possible side effects were far outweighed by the results.  I started the pills April 21st and am down 50 pounds as of June 22nd.  This is a life changer!"""
Cymbalta,Osteoarthritis,"""This was great for pain relief for the two months I was taking it. The problems I had far out weighted any benefits. I was suffering from blackouts where I would do things and not remember doing them. The depression, nausea, and headaches were unbearable too. I have been off it for 2 months now and am just starting to feel better. I&#039;ll live with the on-average 8 pain."""
Uloric,Gout,"""Had gout flares on &amp; off for 30 years. Usually prednisone would clear it up. Tried allupurinol but it made my legs &amp; feet tingly. Tried uloric, no flare ups. Uric acid dropped to 1.9 on 80 mg. Dr changed dose to 40 mg, uric levels staying around 4. Only side effect I&#039;ve noticed is a big increase in dreams. No nightmares or bad dreams ,just a lot of regular dreams. Luckily its carried by the base pharmacy so there is no cost."""
Docosanol,Herpes Simplex,"""Did not work. I used it a day after I felt a small bump. I bought first thing in the morning, used it accordingly and did not see any quicker than usual improvement. 
Expensive for a very small bottle. I suppose it it did work for me it would be worth it and I would use it at least 3 cycles. However, it did nothing. My advice let it run its course. I&#039;m day 12 now and it&#039;s almost gone. Not completely. 
Highly disappointed with the product."""
Plan B,Emergency Contraception,"""My husband and I was in the heat of the moment and we slipped up he came inside me but when I felt it I pushed him off. We already have two children and at the moment can&#039;t afford another child with me joining the military it&#039;s just impossible at the moment. The next day in the afternoon so approximately 17 hours later I went out and bought the generic version of plan B (the cashier assured me it works the same) for $43 that&#039;s including tax. I felt fine after taking it the next day I felt bloated but I knew that was a side affect I just slept it off. Day 3 I didn&#039;t feel too well but I figured it was the pill taking its course. It&#039;s been a week and a half now and I just started my period 10 days early which is another side affect. Works!"""
Implanon,Birth Control,"""I got my Implanon out 2 days ago after having it for the full 3 years , I loved it for the fact I didn&#039;t have to worry about it or getting pregnant, downside is I gained about 4stone and I&#039;m only 20! It was so hard to not gain weight, hopefully now it will be easier, no acne thank God. Having a break from all contraception for a few months and get back on track."""
Betamethasone / calcipotriene,Psoriasis,"""This was prescribed to me for scalp psoriasis after trying a medical shampoo and another topical lotion with no relief from the itch and flakes. I found within the first few applications it relieved the itch and got rid of about 90% of the plaques on my scalp. I have been using it for almost a month now and its made a worlds difference for me! 
The only reason I&#039;ve not given it a 10/10 is how greasy it is, its hard to apply and much harder to remove from my hair. 
After trying a couple of things I&#039;ve found that the trick is to use baby oil to break down the stickiness and use dish soap to wash it out (I do this step at night before bed) then in the morning I use Loreal&#039;s extraordinary clay hair mask to absorb the remaining baby oil!"""
Metronidazole,Bacterial Vaginitis,"""I&#039;m now 30 and have been battling recurrent bv for years now. My Dr. now has upped the dose of metronidazole to 250 mg 4 times daily for 10 days. The average dose never was able to to get rid of it for me. But this last time taking it I haven&#039;t gotten rid of it, so I&#039;m prolonging it another 10 day round. Side effects do suck. I drank on it accidentally forgetting I needed to stay away from alcohol and got really sick. I also take the flagyl but I&#039;m on it longer and its harder to tell if its gone away yet because of it&#039;s side effects. I just worry my body is getting used to the antiobiotic since I&#039;ve used it so much. I&#039;ve tried all the home remedies I found online too. Metronidizole is the only antibiotic I&#039;ve tried that does work to get rid of it."""
Ethinyl estradiol / levonorgestrel,Abnormal Uterine Bleeding,"""I&#039;ve been taking Camrese for almost 6 months and have had nothing but problems. I went on birth control because I had very irregular periods like sometimes a year apart. So I wanted to regulate them so I knew when they were coming. I never had a lot of acne before and ever since taking Camrese my skin has been terrible. Like no matter what I do it doesn&#039;t clear up. I&#039;m bleeding all the time basically for the 3 months with a couple days off. I can&#039;t wait to finish this cycle and either get off birth control completely or switch to a new one because this has made me miserable. Plus the mood swings on it have been ridiculous as well."""
Tamiflu,Swine Flu,"""This medication was seriously a life saver.  I was diagnosed the day after I started showing symptoms and took it pretty much after I left the pharmacy.  I went from a 102 fever to normal within six hours.  It&#039;d day three and I still have a bit of a cough, but I don&#039;t feel nearly as wretched as I have the past couple of days.  The only complaint I would have is it makes me dizzy if I stand up for too long at a time."""
Benzaclin,Acne,"""I&#039;ve been using this for about 3 years now. This is probably the first product I&#039;ve ever used that resulted in clearer skin, both on my face and my body. I went from having at least 5-7 big red pimples at all times, often more when I was on my period, to having clear skin with maybe a few small blemishes most of the time. It took a few months before I noticed it was actually working. Everything was great until 2 months ago, I now have acne just as bad, if not worse, than ever before (face and back). I still use Benzaclin but it&#039;s had absolutely no effect, which is extremely disappointing. Back to square one I guess."""
Yaz,Birth Control,"""Im 20 yr old and have been on birth control for 2 yr now ive tried every pill and even the implant each of them have cause horrid pains and bleeding, i havent got pregnant but experience  bad moods and weight gain, nodoctor can seem to help its very frustrating that each  doctors visit ive only been  prescribed  a higher dosage  of the pill (now yaz) i feel like the only person who is experiencing  this and if the doctors cant help what the heck am i supposed  to do"""
Skyla,Birth Control,"""I got the Skyla put in about three weeks ago. I made my appointment before work thinking I would just have some mild cramping (I can take pain). Nope. It was all good until the doctor got to my uterus. I&#039;m 19 with no kids, and this was the most uncomfortable pain in my life. I could barely stay still and I was screaming on the table. When he was finally done I went pale and felt like I was going to pass out, doubled over with the worst abdominal pain ever. He got me ibuprofen but that did nothing. I had to make an emergency call out to work and I had to stay in the office for at least 45 mins. Could barely drive home and horrible cramps at least 5 hrs after. Now I just take ibuprofen some days I have cramps some days I don&#039;t."""
Sumatriptan,Cluster Headaches,"""Works in about 15 minutes for me which is about twice as fast as the pill form. Creates a bad taste but well worth it for the faster speed."""
Methocarbamol,Muscle Spasm,"""I never knew untill reading this that you can use methocarbamol as an drug addiction helper. I started taken them 5 month ago I only take them once or twice a day if needed 750mg ones. I also take 80mg MST twice daily . But since taking methocarbamol I haven&#039;t needed my ora morph for break through pain relief.  I&#039;m worried I can&#039;t take these for life though can&#039;t get an answer for that."""
Tramadol,Chronic Pain,"""Severe leg cramps in both calves- tingling in both feet"""
Adipex-P,Weight Loss,"""I have been taking this medication for OVER 7 weeks and I have only lost 4 lbs. I barely sleep, even if I take the pill at 6:30 am, and I do have to drink water often due to the dry mouth. The one great thing that I have noticed though, is that I no longer have those uncontrollable cravings for junk food."""
Doxycycline,Acne,"""I&#039;ve always had mild teenage acne since middle achool and nothing worked. I finally decided to go to the dermatologist to get rid of my acne once and for all. Once I got the prescription I was told to avoid dairy. I was so nauseous every day throwing up at school for a week straight. But other than extreme nausea and occasional vomiting within 2 months of diligent pill taking 95% of all my facial, shoulder, chest, back, and cystic acne has cleared. Other than take with food and dairy or prepare for some side effects this has worked wonders. Highly recommend."""
Thyroid desiccated,Hashimoto's disease,"""Ditto all the positives written by other reviewers.  

I don&#039;t understand why it was nearly impossible to get the clinic to prescribe....  I was so miserable on synthroid which I struggled with for 8 mo...with worries of health issues growing.  I quit. And for the next six years at every doctor appt. I flat out refused synthroid.  I think one of the 20 plus fillers was the issue.   Doing my own research I begin requesting Nature Thyroid.  Was told the clinic  only prescribed synthroid. 16 months ago I won!  And have been happy since on NT.  UNBELIEVABLE then when I moved and my new doc in different state suggested I change.  No way.  I&#039;m very happy with Nature Thyroid and think  the medical profession is 75 years behind the times."""
Eszopiclone,Insomnia,"""I finally decided that I&#039;d suffered with insomnia for long enough and my doctor prescribed 5mg of generic zopiclone.  I get the metallic taste shortly after taking it but I&#039;ve learned to keep a small glass of OJ beside the bed. This medication has been my saving grace! I almost get excited when the metallic taste comes now because I know I&#039;ll be sleeping shortly thereafter! If you&#039;ve suffered from insomnia like I have, a little metallic taste in your mouth is a SMALL PRICE TO PAY!  I highly recommend zopiclone for insomnia!"""
Hydromorphone,Pain,"""I read a lot of comments on hydromorphone and thought it would help me greatly with my chronic back pain. So I was shocked when I got the 2mg script and got no relief in pain whatsoever even after taking 6mg. """
Desvenlafaxine,Depression,"""At 47 and pre-menopausal. In addition to having a lung cancer scare (being monitored and if anything were to come out of it, it&#039;s early days). In addition to it a suspicious mammogram and an upcoming colonoscopy (my second) monitoring due to my father passing on from this disease as it was not diagnosed early enough. I was crying for no reason and had no interest in anything.  On Pristiq 2 days now and I feel &quot;different&quot;.  My mood is lighter and I&#039;m not going off on angry tangents for no good reason.  I&#039;m glad it&#039;s not supposed to put on weight - I&#039;m 140 lbs at 5 feet 7 and as I just quit smoking, I will be putting on a few pounds from that.  So far, it&#039;s pretty good."""
Isotretinoin,Acne,"""At the age of 25, I had severe hormonal acne appearing under my chin and on my jawline, deep black heads, scarring, super oil face and hair before taking Accutane. This medication is totally worth it! I&#039;ve tried so many OTC medications, prescribed so many creams and oral pills, chemical peels, dieting, Proactive, etc. Nothing worked! I used to have horrible skin in high school as well and it cleared up for a few years then the acne came back. I went to my dermatologist and she recommend Accutane for 5 months. The first two months I had the initial break out and it sucked but I knew it would get worse before it got better.  My face was pretty clear by the third month. By the fourth month I only had little scars and now I&#039;m acne free!"""
Singulair,Allergic Rhinitis,"""Started to get post nasal drip horribly over four months ago. tried every otc drug know for allergies, remove bedroom carpet, bought high end humidifier, air purifier, netti potted and drank four liters of water a day. Nothing helped and i would wake up every hour and a half coughing from mucus build up. This medication stopped my symptoms within 2 days.
Its very expensive but worth every penny."""
Depo-Provera,Birth Control,"""I opted the depo shot when I was 16. I was horrible at remembering to take medicine on time so I chose the shot. This is my experience. I can only speak for me.
I got the shot in May 2006. Stayed on track of the shot due to the reminder I had a Dr&#039;s appointment on such and such day. I had light, 3 day periods. Never a day longer, never a day shorter. I had no weight gain. I had no cramps. I had no breakouts. I did not experience any dizziness, shortness of breath, or headaches. I didn&#039;t lose my appetite. I had no troubles.
Then, like a genius, when I turned 18 I chose to get off the shot which was due in February. By April I had a positive pregnancy test.
Wasn&#039;t hard for my body to change from even after almost 2 years."""
Bactrim DS,Urinary Tract Infection,"""No health insurance. Went to the ER for UTI and was prescribed Bactrim. UTI symptoms quickly subsided (didn&#039;t disappear completely but like 90% better) so that was nice. Then the Bactrim symptoms started. Oh man. I had a different set of symptoms every day. First it was tingly hands and severe fatigue. Then I had a full blown panic attack (depression and anxiety can be made worse by Bactrim apparently so I tried to keep reminding myself of that). Last couple of days I&#039;ve had headaches and bad nausea. I&#039;m on day 6 of my 7 day course now-- gonna try my best to make it through the whole course but wowww it&#039;s tough. I just hope these symptoms clear up once my pills are gone. It got its job done but made me miserable in the process!"""
Levonorgestrel,Emergency Contraception,"""It all started when this guy I had sex with did it inside me, however I hadn&#039;t taken my birth control in about a year and it was on my most fertile days. (Miscommunication there) I was reading all of these reviews to help me calm down, which did help a little. Took the pill on the second day and three weeks later got my period on time! So thankful for this pill."""
Bupropion,Depression,"""Was taking 20mg of Prozac which worked pretty good. Have taken Adderall in the past for ADD and asked my doctor about it again. He suggested I take Wellbutrin. Been on it for 2 weeks and I really noticed a difference. I actually feel great! 300mg XL. Side effects are minimal. I did feel like a zombie the first and second day. The third day I had the giggles. But, things started to even out after that. It wasn&#039;t anything terrible. It is a little bit harder to go to sleep at night however, I&#039;ve never been a good sleeper. And, dry mouth is kind of bad. Other than that no anxiety depression. Haven&#039;t noticed anything about my ADD yet. I&#039;ll give it a couple more weeks."""
Mesalamine,Ulcerative Colitis,"""I have taken Lialda for a month and my symptoms have stopped. I have side effects of leg cramps. My Dr did not know about this site effect. Makes me wonder about him."""
Acetaminophen / hydrocodone,Pain,"""My physician prescribed Norco 35-325 after I complained of severe abdominal pain and pain in my kidneys. I started taking one tablet every 4-6 hours (sometimes less than 4 hours apart) and it didn&#039;t seem to help with the pain, it would help me sleep sometimes. I started taking two tablets, and it seems to make a noticeable difference. It doesn&#039;t take as long to start working as if I were to just take one. It lasts a while longer too. I&#039;ve tried others and it works just as well but only when I take two."""
Clomiphene,emale Infertility,"""Am new to taking this drug...am very nervous about it and keep staring at the packet..
My husband and I had been trying for 4yrs to get pregnant and nothing g seemed to work. We have a 8 and 5 yr old already all done the natural way..
So we were stuck to why we couldn&#039;t this time round so off we go to the docs and they give me clomid to try.  Before we started I got pregnant Dec 2013 which was amazing feeling. In may 2014 my baby girl came into the world at 26wks and passed away two days later.. 
My periods have been all over the place since so have been given tablets again.
I think I&#039;m ready and my brain is saying it&#039;s now or never...by reading all ur stories it works....
If anything were to happen I couldn&#039;t cope again...
We so want a baby."""
Clarithromycin,Bronchitis,"""I will never even look at those pills again. Took in the morning, and by the evening every side effect hit me like a sledgehammer. Got a couple hours of sleep last night when I wasn&#039;t living in my bathroom and after experiencing the most disturbing dreams in my life I would rather have stayed awake. Who invented something so diabolical???"""
Cobicistat / elvitegravir / emtricitabine / tenofovir,HIV Infection,"""My CD4 was at 3 and I almost died from the AIDS diarrhea and my muscles were tearing from everyday use. After six weeks of Stribild, CD4 was in the 500s range already.  In a couple weeks I will be well enough to go back to work a little short of 3 months of medical leave. Started Stribild on March 18th."""
Phillips' Milk of Magnesia,Constipation,"""I remember this product when I was a kid. My mom used to keep a bottle of it in the house all of the time, that was decades ago. I have used the pill form for the first time and it still works quite well. I find the pill form a little more tolerable then drinking the liquid form. But, what I like about it most is that it doesn&#039;t cause the cramps. For anyone reading, the best time to take any laxative is at night before going to bed. Also take a full 8oz glass of liquid (water preferably) when taking any pill form laxative. Water helps with constipation to begin with. The directions call for 2 to 4 pills, I took 3."""
ParaGard,Birth Control,"""I&#039;ve had the Paragard for about a month. I&#039;ve had no problem with it. I had a C Section 11 weeks prior insertion. Insertion didn&#039;t hurt other than cramping while they were measuring how far to put my IUD. I had light cramping for about two days and spotting and bleeding for about 5 days which is expected. After that everything was great. Checked the strings everything in place. No problems. Now before I got pregnant I already had heavy periods and paragard does not help with that at all. I can&#039;t take hormonal BC due to a blood clotting mutation. When I got my first period after insertion flow was heavy which is normal for me. Cramping on the other hand was more than expected. Nothing I couldn&#039;t handle though. I give 9 out of 10."""
Gabapentin,Peripheral Neuropathy,"""Has helped my quality of life incredibly."""
Fluoxetine,Panic Disorde,"""Cured my panic disorder, which was huge. Also levelled me off emotionally. But...sexual disfunction is definitely an issue. I also seem to have a lack of empathy for others that I don&#039;t like. Overall, though, I&#039;ve been helped by this med."""
Bactrim,Prostatitis,"""Did not work"""
Losartan,High Blood Pressure,"""Very good for me, the only complaint I have is that it&#039;s expensive and a premium co-pay on my Insurance. """
